{
  "schema_version": "1.0.0",
  "lifecycle": {
    "state": "published",
    "appended_at": "2026-02-18T06:10:31.406Z",
    "source": "supabase-legacy-export"
  },
  "segment_id": "c1650afc-85f2-47ce-8f0f-cde56190adbf",
  "route_id": "route-da39a3ee5e6b",
  "name": "c1650afc-85f2-47ce-8f0f-cde56190adbf",
  "segment_type": "unknown",
  "source_legacy": {
    "id": "c1650afc-85f2-47ce-8f0f-cde56190adbf",
    "geometry": {
      "type": "LineString",
      "coordinates": [
        [
          -121.06900000000002,
          38.888720000000006
        ],
        [
          -121.06911000000001,
          38.88855
        ],
        [
          -121.06932,
          38.88844
        ],
        [
          -121.0695,
          38.888380000000005
        ],
        [
          -121.06973,
          38.88826
        ],
        [
          -121.06979000000001,
          38.88814
        ],
        [
          -121.07005000000001,
          38.8881
        ],
        [
          -121.07036000000001,
          38.888110000000005
        ],
        [
          -121.07033000000001,
          38.887890000000006
        ],
        [
          -121.07044,
          38.88736
        ],
        [
          -121.07039,
          38.8872
        ],
        [
          -121.07045000000001,
          38.88694
        ],
        [
          -121.07053,
          38.88683
        ],
        [
          -121.07065000000001,
          38.88674
        ],
        [
          -121.07088000000002,
          38.886680000000005
        ],
        [
          -121.07123000000001,
          38.886520000000004
        ],
        [
          -121.0712,
          38.88644
        ],
        [
          -121.07093,
          38.886120000000005
        ],
        [
          -121.0708,
          38.886030000000005
        ],
        [
          -121.07057,
          38.88597
        ],
        [
          -121.0704,
          38.88597
        ],
        [
          -121.07008,
          38.886030000000005
        ],
        [
          -121.0699,
          38.88604
        ],
        [
          -121.06977,
          38.88597
        ],
        [
          -121.06972,
          38.885870000000004
        ],
        [
          -121.06964,
          38.88555
        ],
        [
          -121.06927,
          38.88501
        ],
        [
          -121.0691,
          38.884690000000006
        ],
        [
          -121.0691,
          38.884440000000005
        ],
        [
          -121.06919,
          38.88418
        ],
        [
          -121.06924000000001,
          38.884100000000004
        ],
        [
          -121.06918,
          38.88402000000001
        ],
        [
          -121.06918,
          38.88389
        ],
        [
          -121.06911000000001,
          38.883480000000006
        ],
        [
          -121.06918,
          38.88335
        ],
        [
          -121.06945,
          38.88295
        ],
        [
          -121.06941,
          38.88289
        ],
        [
          -121.06945,
          38.8828
        ],
        [
          -121.06954,
          38.882650000000005
        ],
        [
          -121.0695,
          38.88232
        ],
        [
          -121.0695,
          38.882130000000004
        ],
        [
          -121.06945,
          38.88197
        ],
        [
          -121.06945,
          38.88183
        ],
        [
          -121.06949000000002,
          38.8817
        ],
        [
          -121.06964,
          38.881510000000006
        ],
        [
          -121.06968,
          38.881420000000006
        ],
        [
          -121.06964,
          38.88129
        ],
        [
          -121.06963,
          38.880900000000004
        ],
        [
          -121.06968,
          38.88076
        ],
        [
          -121.06968,
          38.88073
        ],
        [
          -121.06946,
          38.880610000000004
        ],
        [
          -121.06941,
          38.880500000000005
        ],
        [
          -121.06941,
          38.88038
        ],
        [
          -121.06937,
          38.88036
        ],
        [
          -121.06931000000002,
          38.88035
        ],
        [
          -121.06906000000001,
          38.88042
        ],
        [
          -121.06842,
          38.8804
        ],
        [
          -121.06784,
          38.880230000000005
        ],
        [
          -121.06759000000001,
          38.88008000000001
        ],
        [
          -121.06740499856684,
          38.87955999992286
        ],
        [
          -121.06722,
          38.87904
        ],
        [
          -121.06707000000002,
          38.87867000000001
        ],
        [
          -121.06709000000001,
          38.878350000000005
        ],
        [
          -121.06708,
          38.87814
        ],
        [
          -121.06699,
          38.877930000000006
        ],
        [
          -121.06699,
          38.87778
        ],
        [
          -121.06704,
          38.87774
        ],
        [
          -121.06722,
          38.877660000000006
        ],
        [
          -121.06744,
          38.87753
        ],
        [
          -121.06775,
          38.87747
        ],
        [
          -121.06798,
          38.87731
        ],
        [
          -121.06811,
          38.87727
        ],
        [
          -121.06811,
          38.87724
        ],
        [
          -121.06793,
          38.87713
        ],
        [
          -121.06789,
          38.87702
        ],
        [
          -121.06753,
          38.87702
        ],
        [
          -121.06736000000001,
          38.87691
        ],
        [
          -121.06721,
          38.87673
        ],
        [
          -121.06709000000001,
          38.876540000000006
        ],
        [
          -121.06703000000002,
          38.87646
        ],
        [
          -121.06695,
          38.87633
        ],
        [
          -121.06695,
          38.87624
        ],
        [
          -121.06708,
          38.876180000000005
        ],
        [
          -121.06721,
          38.87614000000001
        ],
        [
          -121.06726,
          38.876070000000006
        ],
        [
          -121.06745000000001,
          38.87563
        ],
        [
          -121.06744,
          38.87539
        ],
        [
          -121.06744,
          38.87527
        ],
        [
          -121.06744,
          38.875260000000004
        ],
        [
          -121.0674,
          38.87518
        ],
        [
          -121.06723000000001,
          38.87519
        ],
        [
          -121.06703000000002,
          38.875170000000004
        ],
        [
          -121.06681,
          38.87511000000001
        ],
        [
          -121.06654,
          38.87512
        ],
        [
          -121.06627,
          38.8751
        ],
        [
          -121.06620000000001,
          38.87507
        ],
        [
          -121.06615000000001,
          38.875
        ],
        [
          -121.0661,
          38.87496
        ],
        [
          -121.06595000000002,
          38.874970000000005
        ],
        [
          -121.06584000000001,
          38.874970000000005
        ],
        [
          -121.0656,
          38.87505
        ],
        [
          -121.06555000000002,
          38.87503
        ],
        [
          -121.06538,
          38.87503
        ],
        [
          -121.0652,
          38.87494
        ],
        [
          -121.06498,
          38.87476
        ],
        [
          -121.06490000000001,
          38.87467
        ],
        [
          -121.06484,
          38.874430000000004
        ],
        [
          -121.06484,
          38.874320000000004
        ],
        [
          -121.06484,
          38.8742
        ],
        [
          -121.06493,
          38.87395
        ],
        [
          -121.06516,
          38.873630000000006
        ],
        [
          -121.06556500200928,
          38.873270000736774
        ],
        [
          -121.06597000000001,
          38.872910000000005
        ],
        [
          -121.06619,
          38.87257
        ],
        [
          -121.06620000000001,
          38.872440000000005
        ],
        [
          -121.06613000000002,
          38.872260000000004
        ],
        [
          -121.0661,
          38.87203
        ],
        [
          -121.06588,
          38.87181
        ],
        [
          -121.06566000000001,
          38.87162
        ],
        [
          -121.0656,
          38.871590000000005
        ],
        [
          -121.06511,
          38.871520000000004
        ],
        [
          -121.06462,
          38.871520000000004
        ],
        [
          -121.06414000000001,
          38.87144
        ],
        [
          -121.06377,
          38.871340000000004
        ],
        [
          -121.06354,
          38.87115
        ],
        [
          -121.06349000000002,
          38.87107
        ],
        [
          -121.06346,
          38.870990000000006
        ],
        [
          -121.06351000000001,
          38.870870000000004
        ],
        [
          -121.06377,
          38.87069
        ],
        [
          -121.06457,
          38.8706
        ],
        [
          -121.06502,
          38.87039
        ],
        [
          -121.06530000000001,
          38.870180000000005
        ],
        [
          -121.06539000000001,
          38.87006
        ],
        [
          -121.06551,
          38.869960000000006
        ],
        [
          -121.06573000000002,
          38.86988
        ],
        [
          -121.06582000000002,
          38.86959
        ],
        [
          -121.06588,
          38.86945
        ],
        [
          -121.06588,
          38.86943
        ],
        [
          -121.06592,
          38.869350000000004
        ],
        [